Date,Heure,Match,Pari,Cote,Risque,Note,Niveau,Statut,MatchID
2025-05-30,19:00,Galatasaray vs Istanbul Basaksehir,Galatasaray gagne,1.85,🟠,3,Élevé,à venir,GALIST20250530
2025-05-30,19:00,Antalyaspor vs Trabzonspor,Plus de 2.5 buts,1.75,🟡,2,Moyen,à venir,ANTTRA20250530
2025-05-30,19:00,Kasimpasa vs Göztepe,Les deux équipes marquent,1.80,🟡,2,Moyen,à venir,KASGOZ20250530
2025-05-30,20:45,Bohemians Dublin vs Derry City,Derry City ou nul,1.65,🟢,1,Faible,à venir,BOHDER20250530
2025-05-30,20:45,Shamrock Rovers vs Galway FC,Shamrock Rovers gagne,1.60,🟢,1,Faible,à venir,SHAGAL20250530
